{
  "schemaVersion": 2,
  "version": "v1.3",
  "repository": {
    "baselineCommit": "7ac9eee452e72ec274e7d7eea1165a629dc0618c",
    "implementationCommit": "209f0b32f8786e91f9833ea979cf914ed86770ee"
  },
  "changeRequest": {
    "kind": "pr",
    "id": "1",
    "url": "https://github.com/Sean-XL196/versioned-prototype-workbench/pull/1",
    "headCommit": "209f0b32f8786e91f9833ea979cf914ed86770ee",
    "mergeCommit": null
  },
  "updatedAt": "2026-09-15T11:05:09.549Z"
}
