{
  "schemaVersion": 2,
  "version": "v1.0",
  "repository": {
    "baselineCommit": "6d6adae6243f4d7ea5ce805628538f56b50cba2b",
    "implementationCommit": "a64460c8ce5f048ac4a210826a5d154907882b45"
  },
  "changeRequest": {
    "kind": null,
    "id": null,
    "url": null,
    "headCommit": null,
    "mergeCommit": null
  },
  "updatedAt": "2026-09-15T09:38:18.954Z"
}
